{
  "record_kind": "badge_aggregate_record",
  "schema_version": 1,
  "notice": "Badge-aggregate truth: every badge count is typed by count class, not by surface; the dock/taskbar, title-bar, in-shell, and companion badges are computed from the same durable object set the activity center reads, so no surface inflates a class; the same underlying object delivered across desktop, companion, and native-notification surfaces dedupes to one durable object and counts once per class; every admin-suppressed, quiet-hours-muted, or per-class-disabled badge difference carries an export-safe lineage entry that preserves the durable object and its reopen target so support can explain a missing alert; a badge count of zero means there are no current durable objects of that class, not that a toast was hidden or a fanout path failed; the persistent attention summary is durable and inspectable in-product; and a snapshot that cannot prove a pillar, or whose lowest badge surface marker is below Stable, narrows below Stable with a named reason rather than inheriting an adjacent green row.",
  "shared_contract_ref": "shell:badge_aggregate_stable:v1",
  "record_id": "badge-aggregate:nominal",
  "as_of": "2026-05-25T12:00:00Z",
  "posture_id": "nominal",
  "posture_label": "Nominal",
  "title": "Badge aggregate: typed count classes from one durable object set",
  "summary": "Whole-shell badge snapshot: every count is typed by class and derived from the same durable object set the activity center reads; cross-client and cross-window copies dedupe to one object so no badge multiplies; a user-muted backlog item shows a zero active badge with its held count and lineage; the dock/taskbar, title-bar, in-shell, and companion projections agree with the activity center; qualifies Stable.",
  "surface_lifecycle_marker": "stable",
  "deduped_objects": [
    {
      "object_ref": "aureline://activity-object/ai-approval",
      "count_class": "pending_review_approval",
      "disposition": "active",
      "label": "AI change awaiting approval (ai-approval)",
      "owner_subsystem": "ai_apply",
      "appearances": [
        "desktop_product",
        "companion_surface"
      ],
      "raw_appearance_count": 2,
      "durable_object_preserved": true,
      "reopen_target_ref": "ux:reopen:ai:approval:05",
      "canonical_event_id": "ux:event:ai:approval:05::ai-approval",
      "dedupe_key_scheme": "cross_client_canonical_event_id",
      "dedupe_key_ref": "ux:event:ai:approval:05::ai-approval",
      "route_outcome_id_ref": "route-outcome:ux:notif-env:ai:approval:05",
      "envelope_id_ref": "ux:notif-env:ai:approval:05"
    },
    {
      "object_ref": "aureline://activity-object/indexing-run",
      "count_class": "durable_running",
      "disposition": "active",
      "label": "Indexing on a partial shard (indexing-run)",
      "owner_subsystem": "indexer",
      "appearances": [
        "desktop_product"
      ],
      "raw_appearance_count": 1,
      "durable_object_preserved": true,
      "reopen_target_ref": "ux:reopen:indexing:shard:01",
      "canonical_event_id": "ux:event:indexing:shard:01::indexing-run",
      "dedupe_key_scheme": "cross_client_canonical_event_id",
      "dedupe_key_ref": "ux:event:indexing:shard:01::indexing-run",
      "route_outcome_id_ref": "route-outcome:ux:notif-env:indexing:shard:01",
      "envelope_id_ref": "ux:notif-env:indexing:shard:01"
    },
    {
      "object_ref": "aureline://activity-object/install-publish",
      "count_class": "queued_publish_later",
      "disposition": "active",
      "label": "Update installed (install-publish)",
      "owner_subsystem": "install_update_attach",
      "appearances": [
        "desktop_product"
      ],
      "raw_appearance_count": 2,
      "durable_object_preserved": true,
      "reopen_target_ref": "ux:reopen:install:update:04",
      "canonical_event_id": "ux:event:install:update:04::install-publish",
      "dedupe_key_scheme": "cross_client_canonical_event_id",
      "dedupe_key_ref": "ux:event:install:update:04::install-publish",
      "route_outcome_id_ref": "route-outcome:ux:notif-env:install:update:04",
      "envelope_id_ref": "ux:notif-env:install:update:04"
    },
    {
      "object_ref": "aureline://activity-object/muted-backlog",
      "count_class": "muted_informational_backlog",
      "disposition": "held_or_suppressed",
      "label": "Managed workspace alert (muted-backlog)",
      "owner_subsystem": "admin_policy",
      "appearances": [
        "desktop_product"
      ],
      "raw_appearance_count": 1,
      "durable_object_preserved": true,
      "reopen_target_ref": "ux:reopen:managed:alert:09",
      "canonical_event_id": "ux:event:managed:alert:09::muted-backlog",
      "dedupe_key_scheme": "cross_client_canonical_event_id",
      "dedupe_key_ref": "ux:event:managed:alert:09::muted-backlog",
      "route_outcome_id_ref": "route-outcome:ux:notif-env:managed:alert:09",
      "envelope_id_ref": "ux:notif-env:managed:alert:09"
    },
    {
      "object_ref": "aureline://activity-object/policy-advisory",
      "count_class": "managed_advisories",
      "disposition": "active",
      "label": "Workspace policy changed (policy-advisory)",
      "owner_subsystem": "admin_policy",
      "appearances": [
        "desktop_product",
        "managed_admin_surface"
      ],
      "raw_appearance_count": 2,
      "durable_object_preserved": true,
      "reopen_target_ref": "ux:reopen:policy:change:07",
      "canonical_event_id": "ux:event:policy:change:07::policy-advisory",
      "dedupe_key_scheme": "cross_client_canonical_event_id",
      "dedupe_key_ref": "ux:event:policy:change:07::policy-advisory",
      "route_outcome_id_ref": "route-outcome:ux:notif-env:policy:change:07",
      "envelope_id_ref": "ux:notif-env:policy:change:07"
    },
    {
      "object_ref": "aureline://activity-object/provider-auth",
      "count_class": "provider_auth_attention",
      "disposition": "active",
      "label": "Provider sync needs re-auth (provider-auth)",
      "owner_subsystem": "provider_bearing",
      "appearances": [
        "desktop_product",
        "companion_surface"
      ],
      "raw_appearance_count": 2,
      "durable_object_preserved": true,
      "reopen_target_ref": "ux:reopen:provider:sync:06",
      "canonical_event_id": "ux:event:provider:sync:06::provider-auth",
      "dedupe_key_scheme": "cross_client_canonical_event_id",
      "dedupe_key_ref": "ux:event:provider:sync:06::provider-auth",
      "route_outcome_id_ref": "route-outcome:ux:notif-env:provider:sync:06",
      "envelope_id_ref": "ux:notif-env:provider:sync:06"
    },
    {
      "object_ref": "aureline://activity-object/provider-failed-run",
      "count_class": "failed_runs",
      "disposition": "active",
      "label": "Provider sync needs re-auth (provider-failed-run)",
      "owner_subsystem": "provider_bearing",
      "appearances": [
        "desktop_product"
      ],
      "raw_appearance_count": 1,
      "durable_object_preserved": true,
      "reopen_target_ref": "ux:reopen:provider:sync:06",
      "canonical_event_id": "ux:event:provider:sync:06::provider-failed-run",
      "dedupe_key_scheme": "cross_client_canonical_event_id",
      "dedupe_key_ref": "ux:event:provider:sync:06::provider-failed-run",
      "route_outcome_id_ref": "route-outcome:ux:notif-env:provider:sync:06",
      "envelope_id_ref": "ux:notif-env:provider:sync:06"
    },
    {
      "object_ref": "aureline://activity-object/remote-session",
      "count_class": "session_requests",
      "disposition": "active",
      "label": "Remote session reconnected (remote-session)",
      "owner_subsystem": "remote_agent",
      "appearances": [
        "desktop_product",
        "remote_agent"
      ],
      "raw_appearance_count": 2,
      "durable_object_preserved": true,
      "reopen_target_ref": "ux:reopen:remote:reconnect:08",
      "canonical_event_id": "ux:event:remote:reconnect:08::remote-session",
      "dedupe_key_scheme": "cross_client_canonical_event_id",
      "dedupe_key_ref": "ux:event:remote:reconnect:08::remote-session",
      "route_outcome_id_ref": "route-outcome:ux:notif-env:remote:reconnect:08",
      "envelope_id_ref": "ux:notif-env:remote:reconnect:08"
    }
  ],
  "class_aggregates": [
    {
      "count_class": "pending_review_approval",
      "active_count": 1,
      "held_or_suppressed_count": 0,
      "cleared_count": 0,
      "privacy_safe_summary_label": "1 review item"
    },
    {
      "count_class": "failed_runs",
      "active_count": 1,
      "held_or_suppressed_count": 0,
      "cleared_count": 0,
      "privacy_safe_summary_label": "1 failed run"
    },
    {
      "count_class": "queued_publish_later",
      "active_count": 1,
      "held_or_suppressed_count": 0,
      "cleared_count": 0,
      "privacy_safe_summary_label": "1 queued publish item"
    },
    {
      "count_class": "provider_auth_attention",
      "active_count": 1,
      "held_or_suppressed_count": 0,
      "cleared_count": 0,
      "privacy_safe_summary_label": "1 provider sign-in"
    },
    {
      "count_class": "managed_advisories",
      "active_count": 1,
      "held_or_suppressed_count": 0,
      "cleared_count": 0,
      "privacy_safe_summary_label": "1 managed advisory"
    },
    {
      "count_class": "muted_informational_backlog",
      "active_count": 0,
      "held_or_suppressed_count": 1,
      "cleared_count": 0,
      "privacy_safe_summary_label": "No active muted items; 1 held"
    },
    {
      "count_class": "session_requests",
      "active_count": 1,
      "held_or_suppressed_count": 0,
      "cleared_count": 0,
      "privacy_safe_summary_label": "1 session request"
    },
    {
      "count_class": "durable_running",
      "active_count": 1,
      "held_or_suppressed_count": 0,
      "cleared_count": 0,
      "privacy_safe_summary_label": "1 running item"
    }
  ],
  "surface_projections": [
    {
      "surface": "activity_center",
      "surface_marker": "stable",